{
  "$schema": "https://json-schema.org/draft/2020-12/schema",
  "title": "alerts",
  "description": "漏讲提醒与薄弱点。B → C。outbox alerts.json。不离开老师电脑。§5",
  "type": "object",
  "additionalProperties": false,
  "required": ["lesson_id", "missed", "covered_before", "weak_from_reports"],
  "properties": {
    "lesson_id": {"type": "string", "pattern": "^L-[A-Za-z0-9]+-\\d{8}-\\d{4}$"},
    "missed": {
      "type": "array",
      "items": {"type": "object", "additionalProperties": false, "required": ["kp_id", "note"],
                "properties": {"kp_id": {"type": "string", "minLength": 1}, "note": {"type": "string"}}}
    },
    "covered_before": {
      "type": "array",
      "items": {"type": "object", "additionalProperties": false, "required": ["kp_id", "last_covered_at"],
                "properties": {"kp_id": {"type": "string", "minLength": 1}, "last_covered_at": {"type": "string", "pattern": "^\\d{4}-\\d{2}-\\d{2}T\\d{2}:\\d{2}:\\d{2}(\\.\\d+)?[+-]\\d{2}:\\d{2}$"}}}
    },
    "weak_from_reports": {
      "type": "array",
      "items": {"type": "object", "additionalProperties": false, "required": ["kp_id", "source", "seen_at"],
                "properties": {"kp_id": {"type": "string", "minLength": 1}, "source": {"type": "string", "minLength": 1}, "seen_at": {"type": "string", "pattern": "^\\d{4}-\\d{2}-\\d{2}T\\d{2}:\\d{2}:\\d{2}(\\.\\d+)?[+-]\\d{2}:\\d{2}$"}}}
    }
  }
}
